{
  "id": "neurips",
  "name": "NeurIPS",
  "version": "v1",
  "quality_threshold": 0.82,
  "dimension_threshold": 0.65,
  "max_iterations": 4,
  "required_kinds": ["methodology", "system_overview", "results_plot"],
  "arch_critique_block_severity": "major",
  "repro_audit_mode": "hard",
  "template_pack": "expanded_v1",
  "notes": "NeurIPS profile: higher critique gates, required methodology/system/results figures."
}
